<?xml version="1.0" encoding="UTF-8"?>

<xs:schema
            attributeFormDefault="unqualified"
            elementFormDefault="qualified"
            xmlns:xs="http://www.w3.org/2001/XMLSchema">
    <xs:element name="Candy">
        <xs:complexType>
            <xs:sequence>
                <xs:element name="Candies" maxOccurs="unbounded" minOccurs="1">
                    <xs:complexType>
                        <xs:sequence>
                            <xs:element type="xs:string" name="Name"/>
                            <xs:element name="Energy"/>
                            <xs:element name="Type">
                                <xs:simpleType>
                                    <xs:restriction base="xs:string">
                                        <xs:enumeration value="caramel"/>
                                        <xs:enumeration value="lollipop caramel"/>
                                        <xs:enumeration value="chocolate with filling"/>
                                        <xs:enumeration value="coconut with filling"/>
                                    </xs:restriction>
                                </xs:simpleType>
                            </xs:element>
                            <xs:element name="Ingredients">
                                <xs:complexType>
                                    <xs:sequence>
                                        <xs:element name="Water">
                                            <xs:simpleType>
                                                <xs:restriction base="xs:int">
                                                    <xs:minInclusive value="0"/>
                                                </xs:restriction>
                                            </xs:simpleType>
                                        </xs:element>
                                        <xs:element name="Sugar">
                                            <xs:simpleType>
                                                <xs:restriction base="xs:int">
                                                    <xs:minInclusive value="0"/>
                                                </xs:restriction>
                                            </xs:simpleType>
                                        </xs:element>
                                        <xs:element name="Fructose">
                                            <xs:simpleType>
                                                <xs:restriction base="xs:int">
                                                    <xs:minInclusive value="0"/>
                                                </xs:restriction>
                                            </xs:simpleType>
                                        </xs:element>
                                        <xs:element name="Vanillin">
                                            <xs:simpleType>
                                                <xs:restriction base="xs:int">
                                                    <xs:minInclusive value="0"/>
                                                </xs:restriction>
                                            </xs:simpleType>
                                        </xs:element>
                                    </xs:sequence>
                                </xs:complexType>
                            </xs:element>
                            <xs:element name="Value">
                                <xs:complexType>
                                    <xs:sequence>
                                        <xs:element name="Proteins">
                                            <xs:simpleType>
                                                <xs:restriction base="xs:double">
                                                    <xs:minInclusive value="0"/>
                                                </xs:restriction>
                                            </xs:simpleType>
                                        </xs:element>
                                        <xs:element name="Fats">
                                            <xs:simpleType>
                                                <xs:restriction base="xs:double">
                                                    <xs:minInclusive value="0"/>
                                                </xs:restriction>
                                            </xs:simpleType>
                                        </xs:element>
                                        <xs:element name="Carbohydrates">
                                            <xs:simpleType>
                                                <xs:restriction base="xs:double">
                                                    <xs:minInclusive value="0"/>
                                                </xs:restriction>
                                            </xs:simpleType>
                                        </xs:element>
                                    </xs:sequence>
                                </xs:complexType>
                            </xs:element>
                            <xs:element type="xs:string" name="Production"/>
                        </xs:sequence>
                        <xs:attribute type="xs:string" name="id" use="required"/>
                    </xs:complexType>
                </xs:element>
            </xs:sequence>
        </xs:complexType>
    </xs:element>
</xs:schema>